<?xml version="1.0" encoding="UTF-8"?>
<venda moeda="real" xsi:noNamespaceSchemaLocation="venda.xsd" xmlns:xsi="http://www.w3.org/2001/XMLSchema-instance">
	<formaPagamento>Credito</formaPagamento>
	<produtos>
		<produto>
			<nome>Livro 01</nome>
			<valor>19.90</valor>
		</produto>
		<produto>
			<nome>Livro 02</nome>
			<valor>19.90</valor>
		</produto>
	</produtos>
</venda>